Nome Quartiere;Categoria;Nome;Descrizione;orari_di_apertura_invernali;orari_di_apertura_estivi;indirizzo;latitudine;longitudine;Geo Shape;Geo Point
Porto - Saragozza;Musei;Urban Center di Bologna;Urban Center Bologna è il luogo in cui puoi conoscere le principali politiche e i progetti che stanno cambiando Bologna e il territorio metropolitano e in cui cittadini, istituzioni pubbliche, associazioni e rappresentanti del mondo economico e sociale possono incontrarsi e discutere le ...;;;Salaborsa Piazza Nettuno, 3 - 40124 Bologna;44.494583;11.342352;"{""coordinates"": [11.342352, 44.494583], ""type"": ""Point""}";44.494583, 11.342352
Porto - Saragozza;Musei;"Museo del Tessuto e della Tappezzeria ""Vittorio Zironi""";La raccolta dei reperti oggi esposti nel Museo del Tessuto e della Tappezzeria inizia nel 1946 a cura del bolognese Cav. Vittorio Zironi.  Il 6 Novembre 1966 venne ufficialmente inaugurata la prima sede del Museo dall'on. Elkan in via Barberia. Però, in seguito all'aumentare del …;accesso momentaneamente sospeso;accesso momentaneamente sospeso;c/o Villa Spada, Via di Casaglia, 3 - 40135 Bologna;44.488648;11.316025;"{""coordinates"": [11.316025, 44.488648], ""type"": ""Point""}";44.488648, 11.316025
Santo Stefano;Musei;Musei Universitari - Erbario;L'Erbario dell'Università di Bologna, è uno dei più antichi d'Europa. In esso si conservano collezioni di piante essiccate raccolte dal XVI secolo in poi. La sua consistenza attuale è stimata in circa 110.000 piante essiccate e una completa catalogazione su computer di tutte le raccolte è in...;;;Via Irnerio, 42 - 40126 Bologna;44.499258;11.352862;"{""coordinates"": [11.352862, 44.499258], ""type"": ""Point""}";44.499258, 11.352862
Santo Stefano;Musei;Musei Universitari - MeuS. Museo europeo degli Studenti;Come più antico ateneo europeo e sede delle prime università studentesche del mondo intero, l'Alma Mater ha promosso un'iniziativa culturale per favorire la conoscenza e lo studio del mondo studentesco, dando vita a una struttura museale, espressamente dedicata a ripercorrere, attraverso oltre ...;;;Via Zamboni, 33 - 40126 Bologna;44.496977;11.352503;"{""coordinates"": [11.352503, 44.496977], ""type"": ""Point""}";44.496977, 11.352503
Santo Stefano;Musei;"Musei Universitari - Museo di Paleontologia e Geologia ""G.Capellini""";Il Museo si articola in quindici sale ed è suddiviso in quattro sezioni: antiche collezioni, piante fossili, vertebrati fossili, collezione di rocce ed invertebrati, fossili ordinati per località geografiche italiane ed estere. La descrizione è tratta da S.M.A. - Sistema Museale d'Ateneo Alma ...;;;Via Zamboni, 63 - 40126 Bologna;44.497777;11.355193;"{""coordinates"": [11.355193, 44.497777], ""type"": ""Point""}";44.497777, 11.355193
Porto - Saragozza;Musei;Museo della Resistenza;Il museo ha sede nel complesso dell'ex Convento di San Mattia, sorto intorno alla metà del Duecento come dipendenza del Convento di Santa Maria del Monte della Guardia, delle suore di regola agostiniana, presso Porta Saragozza, poi di regola domenicana dal 1278. Distrutto nel corso di conflitti ...;;;c/o Ex convento di S. Mattia, Via Sant'Isaia, 20 - 40123 Bologna;44.49361;11.333747;"{""coordinates"": [11.333747, 44.49361], ""type"": ""Point""}";44.49361, 11.333747
Porto - Saragozza;Musei;Musei ecclesiastici - Museo Corpus Domini o Chiesa della Santa;Annesso alla chiesa del Corpus Domini, il museo conserva il corpo seduto e incorrotto di Santa Caterina de’ Vigri (1413-1463). Ormai annerito dai secoli è esposto ai fedeli nel suo vestito del saio francescano e siede su uno scanno di legno dorato donato al Convento da Giovanni II Bentivoglio ...;;;Corpus Domini o Chiesa della Santa Via Tagliapietre, 21 - 40123 Bologna;44.488829;11.339738;"{""coordinates"": [11.339738, 44.488829], ""type"": ""Point""}";44.488829, 11.339738
Porto - Saragozza;Musei;Palazzo Fava. Palazzo delle Esposizioni;Palazzo Fava. Palazzo delle Esposizioni, ha una superficie di oltre 2600 metri quadrati ed è una struttura regolare di esposizioni, il cui progetto di allestimento è stato firmato dall’Arch. Michele De Lucchi ed è strutturato su 4 livelli espositivi così delineati: -piano terra: collezione ...;;;Via Manzoni, 2 - 40121 Bologna;44.496374;11.342763;"{""coordinates"": [11.342763, 44.496374], ""type"": ""Point""}";44.496374, 11.342763
